{
  "contracts": {
    "provides": [
      {
        "cardinality": "one",
        "failure": "isolate",
        "id": "rumi.resource.ai.model.profile.v1",
        "isolation": "process",
        "lifecycle": {
          "data_owner": "rumi_model_registry_pack",
          "deprecated": false,
          "introduced": "1.0.0",
          "migration_id": "model-profiles-v1",
          "rollback_id": "model-profiles-v1"
        },
        "provider_instance_id": "model-registry.profile",
        "required_capabilities": [
          "ai.model.profile.read"
        ],
        "schemas": {
          "input": {
            "type": "object"
          },
          "output": {
            "type": "object"
          }
        },
        "security": "sensitive",
        "version": "1.0.0"
      },
      {
        "cardinality": "one",
        "failure": "fail_closed",
        "id": "rumi.action.ai.model.profile.manage.v1",
        "isolation": "process",
        "lifecycle": {
          "data_owner": "rumi_model_registry_pack",
          "deprecated": false,
          "introduced": "1.0.0",
          "migration_id": "model-profiles-v1",
          "rollback_id": "model-profiles-v1"
        },
        "provider_instance_id": "model-registry.manage",
        "required_capabilities": [
          "ai.model.profile.manage"
        ],
        "schemas": {
          "input": {
            "type": "object"
          },
          "output": {
            "type": "object"
          }
        },
        "security": "restricted",
        "version": "1.0.0"
      },
      {
        "cardinality": "one",
        "failure": "fail_closed",
        "id": "rumi.action.ai.model.registry.migrate.v1",
        "isolation": "process",
        "lifecycle": {
          "data_owner": "rumi_model_registry_pack",
          "deprecated": false,
          "introduced": "1.0.0",
          "migration_id": "model-profiles-v1",
          "rollback_id": "model-profiles-v1"
        },
        "provider_instance_id": "model-registry.migrate",
        "required_capabilities": [
          "ai.model.profile.migrate"
        ],
        "schemas": {
          "input": {
            "type": "object"
          },
          "output": {
            "type": "object"
          }
        },
        "security": "restricted",
        "version": "1.0.0"
      }
    ],
    "requires": []
  },
  "entrypoints": [
    {
      "artifact_hash": "sha256:3984812ff37880b6da753b76756a63c895c3fd0d7dcbbe806a9d8c9d192ba37d",
      "contract_id": "rumi.resource.ai.model.profile.v1",
      "id": "model-profile-resource",
      "loader": "process",
      "module": "ecosystem.rumi_model_registry_pack.runtime.process"
    },
    {
      "artifact_hash": "sha256:3984812ff37880b6da753b76756a63c895c3fd0d7dcbbe806a9d8c9d192ba37d",
      "contract_id": "rumi.action.ai.model.profile.manage.v1",
      "id": "model-profile-manage",
      "loader": "process",
      "module": "ecosystem.rumi_model_registry_pack.runtime.process"
    },
    {
      "artifact_hash": "sha256:3984812ff37880b6da753b76756a63c895c3fd0d7dcbbe806a9d8c9d192ba37d",
      "contract_id": "rumi.action.ai.model.registry.migrate.v1",
      "id": "model-registry-migrate",
      "loader": "process",
      "module": "ecosystem.rumi_model_registry_pack.runtime.process"
    }
  ],
  "extensions": {
    "rumi.legacy_projection": {
      "dependencies": {},
      "host_execution": true,
      "manifest": {
        "connectivity": {
          "provides": [
            "rumi.action.ai.model.profile.manage.v1",
            "rumi.action.ai.model.registry.migrate.v1",
            "rumi.resource.ai.model.profile.v1"
          ],
          "requires": []
        },
        "dependencies": {},
        "description": "Provider-neutral saved model profiles, aliases, migration, and rollback.",
        "display_name": "Rumi Model Registry",
        "host_execution": true,
        "metadata": {
          "authoritative_owner": true,
          "canonical_v4": {
            "artifact": "pack.v4.json",
            "artifact_digest": "sha256:ac00774c873f419de41b89b9013caf59c51a42b36a30f473a0a405e9c4f90bc6",
            "generator": "tobkiri.scripts.migrate_manifest_authority/v2",
            "source_identity": "sha256:21e271f13770a9813bf3f3a7d7932d8e9e615cdb496bc095773479e538721937"
          },
          "executable_code": true,
          "integrity": {
            "artifact_manifest": "artifact-manifest.json"
          },
          "owner_surfaces": [
            "model_profiles",
            "model_aliases"
          ],
          "projection_owner": "scripts/migrate_manifest_authority.py",
          "security": {
            "atomic_write": true,
            "opaque_credentials_only": true,
            "optimistic_revision": true,
            "provider_neutral": true
          },
          "storage_namespace": "rumi.model_profiles"
        },
        "pack_id": "rumi_model_registry_pack",
        "pack_identity": "rumi:ecosystem/rumi_model_registry_pack",
        "provenance": {
          "build_identity": "rumi_model_registry_pack:1.0.1",
          "content_hash": "sha256:ba316e4b25094d900e1ee225e51d071243fbd1fd586f6cbf997d1689367787e3",
          "signature": null,
          "trust_class": "local"
        },
        "required_capabilities": [
          "ai.model.profile.manage",
          "ai.model.profile.migrate",
          "ai.model.profile.read"
        ],
        "required_network": {
          "allowed_domains": [],
          "allowed_ports": []
        },
        "required_secrets": [],
        "resources": [],
        "version": "1.0.0",
        "vocabulary": {
          "types": [
            "service"
          ]
        }
      },
      "pack_id": "rumi_model_registry_pack"
    },
    "rumi.model_registry.boundary": {
      "catalog_owner": false,
      "credential_values_accepted": false,
      "provider_execution_owner": false,
      "provider_pack_id_branches": false
    },
    "tobkiri.offline_projection": {
      "generator": "tobkiri.scripts.migrate_manifest_authority/v2",
      "owner": "rumi_model_registry_pack",
      "runtime_executable": false,
      "source": "pack.v4.json",
      "source_identity": "sha256:21e271f13770a9813bf3f3a7d7932d8e9e615cdb496bc095773479e538721937"
    }
  },
  "migration": {
    "compatibility_aliases": [],
    "compatibility_projection": "legacy_to_v3_read_only",
    "from": [
      "defaultspack.ai_client.saved_models",
      "defaultspack.ai_client.model_aliases"
    ],
    "removal_wave": 10,
    "rollback": "Remove migrated owner state and restore the owner-only source backup.",
    "sunset_at": "2027-12-31"
  },
  "pack": {
    "description": "Provider-neutral saved model profiles, aliases, migration, and rollback.",
    "display_name": "Rumi Model Registry",
    "id": "rumi.model_registry",
    "kind": "service",
    "version": "1.0.0"
  },
  "pack_api_version": "rumi.pack.v3",
  "permissions": [
    {
      "access": "read",
      "approval_required": false,
      "capability": "ai.model.profile.read"
    },
    {
      "access": "control",
      "approval_required": true,
      "capability": "ai.model.profile.manage"
    },
    {
      "access": "control",
      "approval_required": true,
      "capability": "ai.model.profile.migrate"
    }
  ],
  "provenance": {
    "build_identity": "rumi_model_registry_pack:1.0.1",
    "content_hash": "sha256:ba316e4b25094d900e1ee225e51d071243fbd1fd586f6cbf997d1689367787e3",
    "signature": null,
    "trust_class": "local"
  },
  "resources": [],
  "storage": [
    {
      "authoritative": true,
      "export_import": true,
      "namespace": "rumi.model_profiles",
      "retention": "until explicit deletion or profile migration rollback",
      "schema_version": "1.0.0"
    }
  ]
}
