{
  "contracts": {
    "provides": [
      {
        "cardinality": "many",
        "failure": "fail_closed",
        "id": "rumi.service.tool.execute.v1",
        "isolation": "in_process",
        "lifecycle": {
          "data_owner": "sandbox-runtime",
          "deprecated": false,
          "introduced": "1.0.0"
        },
        "provider_instance_id": "tool-executor.sandbox",
        "required_capabilities": [
          "tool.execute"
        ],
        "routing_keys": [
          "sandbox"
        ],
        "schemas": {
          "input": {
            "type": "object"
          },
          "output": {
            "type": "object"
          }
        },
        "security": "restricted",
        "version": "1.0.0"
      }
    ],
    "requires": []
  },
  "entrypoints": [
    {
      "artifact_hash": "sha256:5f36220d03bdd6a8ef2381cc21e450309315e912f6e57fddf6f592bea3ae0350",
      "contract_id": "rumi.service.tool.execute.v1",
      "id": "tool-sandbox-execute",
      "loader": "python",
      "module": "ecosystem.rumi_tool_sandbox_executor_pack.runtime.executor",
      "symbol": "create_execute_operation"
    }
  ],
  "extensions": {
    "rumi.legacy_projection": {
      "dependencies": {},
      "host_execution": true,
      "manifest": {
        "connectivity": {
          "provides": [
            "rumi.service.tool.execute.v1"
          ],
          "requires": []
        },
        "dependencies": {},
        "description": "Docker-calling-convention-only tool executor.",
        "display_name": "Rumi Tool Sandbox Executor",
        "host_execution": true,
        "metadata": {
          "authoritative_owner": false,
          "canonical_v4": {
            "artifact": "pack.v4.json",
            "artifact_digest": "sha256:401dbc8f2cd19d20e3ced38e468139430755a3ae8e935d17237f7957e3c9784d",
            "generator": "tobkiri.scripts.migrate_manifest_authority/v2",
            "source_identity": "sha256:7f02e4619f61e4a8bc052cc94f6c494662c9203b5d93f713f82cf57035cdfc71"
          },
          "integrity": {
            "artifact_manifest": "artifact-manifest.json"
          },
          "owner_surfaces": [
            "sandbox_tool_adapter"
          ],
          "projection_owner": "scripts/migrate_manifest_authority.py",
          "security": {
            "calling_convention": "python_docker",
            "host_downgrade": false
          }
        },
        "pack_id": "rumi_tool_sandbox_executor_pack",
        "pack_identity": "rumi:ecosystem/rumi_tool_sandbox_executor_pack",
        "provenance": {
          "build_identity": "rumi_tool_sandbox_executor_pack:1.0.0",
          "content_hash": "sha256:712200ecdc832ee234ee6f3aa794d72a62696eeedc1ba43c02cd916425eedbf6",
          "signature": null,
          "trust_class": "local"
        },
        "required_capabilities": [
          "tool.execute"
        ],
        "required_network": {
          "allowed_domains": [],
          "allowed_ports": []
        },
        "required_secrets": [],
        "resources": [],
        "version": "1.0.0",
        "vocabulary": {
          "types": [
            "service"
          ]
        }
      },
      "pack_id": "rumi_tool_sandbox_executor_pack"
    },
    "rumi.tool_executor.boundary": {
      "calling_convention": "python_docker",
      "execution_kind": "sandbox",
      "host_downgrade": false
    },
    "tobkiri.offline_projection": {
      "generator": "tobkiri.scripts.migrate_manifest_authority/v2",
      "owner": "rumi_tool_sandbox_executor_pack",
      "runtime_executable": false,
      "source": "pack.v4.json",
      "source_identity": "sha256:7f02e4619f61e4a8bc052cc94f6c494662c9203b5d93f713f82cf57035cdfc71"
    }
  },
  "migration": {
    "compatibility_aliases": [],
    "compatibility_projection": "none",
    "from": [
      "defaultspack.domain.tool.executor.python_docker",
      "rumi_sandbox_runtime_pack"
    ],
    "removal_wave": 10,
    "rollback": "Remove this adapter; sandbox runtime services remain independently available.",
    "sunset_at": "2027-12-31"
  },
  "pack": {
    "description": "Docker-calling-convention-only tool executor.",
    "display_name": "Rumi Tool Sandbox Executor",
    "id": "rumi.tool_sandbox_executor",
    "kind": "adapter",
    "version": "1.0.0"
  },
  "pack_api_version": "rumi.pack.v3",
  "permissions": [
    {
      "access": "execute",
      "approval_required": false,
      "capability": "tool.execute"
    }
  ],
  "provenance": {
    "build_identity": "rumi_tool_sandbox_executor_pack:1.0.0",
    "content_hash": "sha256:712200ecdc832ee234ee6f3aa794d72a62696eeedc1ba43c02cd916425eedbf6",
    "signature": null,
    "trust_class": "local"
  },
  "resources": [],
  "storage": []
}
