{
  "contracts": {
    "provides": [
      {
        "cardinality": "one",
        "failure": "fail_closed",
        "id": "rumi.resource.mcp.server.tool.catalog.v1",
        "isolation": "in_process",
        "lifecycle": {
          "data_owner": "rumi_tool_registry_pack",
          "deprecated": false,
          "introduced": "1.0.0"
        },
        "provider_instance_id": "mcp-server.catalog",
        "required_capabilities": [
          "mcp.server.catalog.read"
        ],
        "schemas": {
          "input": {
            "type": "object"
          },
          "output": {
            "type": "object"
          }
        },
        "security": "sensitive",
        "version": "1.0.0"
      },
      {
        "cardinality": "one",
        "failure": "fail_closed",
        "id": "rumi.service.mcp.server.tool.call.v1",
        "isolation": "in_process",
        "lifecycle": {
          "data_owner": "caller",
          "deprecated": false,
          "introduced": "1.0.0"
        },
        "provider_instance_id": "mcp-server.call",
        "required_capabilities": [
          "mcp.server.tool.call"
        ],
        "schemas": {
          "input": {
            "type": "object"
          },
          "output": {
            "type": "object"
          }
        },
        "security": "restricted",
        "version": "1.0.0"
      }
    ],
    "requires": [
      {
        "cardinality": "one",
        "id": "rumi.resource.tool.definition.v1",
        "optional": false,
        "version_range": "^1.0.0"
      },
      {
        "cardinality": "one",
        "id": "rumi.service.tool.invoke.v1",
        "optional": false,
        "version_range": "^1.0.0"
      }
    ]
  },
  "entrypoints": [
    {
      "artifact_hash": "sha256:550e6aa813f9216b05a85f5f28f035497596f982b5ffdba117ce3a7692394745",
      "contract_id": "rumi.resource.mcp.server.tool.catalog.v1",
      "id": "mcp-server-tool-catalog",
      "loader": "python",
      "module": "ecosystem.rumi_mcp_server_pack.runtime.server",
      "symbol": "create_catalog_operation"
    },
    {
      "artifact_hash": "sha256:550e6aa813f9216b05a85f5f28f035497596f982b5ffdba117ce3a7692394745",
      "contract_id": "rumi.service.mcp.server.tool.call.v1",
      "id": "mcp-server-tool-call",
      "loader": "python",
      "module": "ecosystem.rumi_mcp_server_pack.runtime.server",
      "symbol": "create_call_operation"
    }
  ],
  "extensions": {
    "rumi.legacy_projection": {
      "dependencies": {},
      "host_execution": true,
      "manifest": {
        "connectivity": {
          "provides": [
            "rumi.resource.mcp.server.tool.catalog.v1",
            "rumi.service.mcp.server.tool.call.v1"
          ],
          "requires": [
            "rumi.resource.tool.definition.v1",
            "rumi.service.tool.invoke.v1"
          ]
        },
        "dependencies": {},
        "description": "MCP server catalog and call projection over the global tool broker.",
        "display_name": "Rumi MCP Server",
        "host_execution": true,
        "metadata": {
          "authoritative_owner": false,
          "canonical_v4": {
            "artifact": "pack.v4.json",
            "artifact_digest": "sha256:cf7e9d782f5a42f460c185cd2c2a410f13215b35124c4d6df5e78ec5f3c148a4",
            "generator": "tobkiri.scripts.migrate_manifest_authority/v2",
            "source_identity": "sha256:3defa73d8642525f762fcd310f58d562ecff501d3655b304b020381a71ba0233"
          },
          "integrity": {
            "artifact_manifest": "artifact-manifest.json"
          },
          "owner_surfaces": [
            "mcp_server_tool_projection"
          ],
          "projection_owner": "scripts/migrate_manifest_authority.py",
          "security": {
            "approval_bypass": false,
            "transport_owner": false
          }
        },
        "pack_id": "rumi_mcp_server_pack",
        "pack_identity": "rumi:ecosystem/rumi_mcp_server_pack",
        "provenance": {
          "build_identity": "rumi_mcp_server_pack:1.0.0",
          "content_hash": "sha256:a54adc7a4a7c6ab9a2edaa8ec562540b971618936eadcc1ed79a46d87b35b686",
          "signature": null,
          "trust_class": "local"
        },
        "required_capabilities": [
          "mcp.server.catalog.read",
          "mcp.server.tool.call"
        ],
        "required_network": {
          "allowed_domains": [],
          "allowed_ports": []
        },
        "required_secrets": [],
        "resources": [],
        "version": "1.0.0",
        "vocabulary": {
          "types": [
            "service"
          ]
        }
      },
      "pack_id": "rumi_mcp_server_pack"
    },
    "rumi.mcp_server.boundary": {
      "approval_bypass": false,
      "namespace_prefix": "rumi.",
      "tool_owner": false,
      "transport_owner": false
    },
    "tobkiri.offline_projection": {
      "generator": "tobkiri.scripts.migrate_manifest_authority/v2",
      "owner": "rumi_mcp_server_pack",
      "runtime_executable": false,
      "source": "pack.v4.json",
      "source_identity": "sha256:3defa73d8642525f762fcd310f58d562ecff501d3655b304b020381a71ba0233"
    }
  },
  "migration": {
    "compatibility_aliases": [],
    "compatibility_projection": "legacy_to_v3_read_only",
    "from": [
      "defaultspack.backend.mcp_transport"
    ],
    "removal_wave": 10,
    "rollback": "Remove the server projection without removing tool definitions or services.",
    "sunset_at": "2027-12-31"
  },
  "pack": {
    "description": "MCP server catalog and call projection over the global tool broker.",
    "display_name": "Rumi MCP Server",
    "id": "rumi.mcp_server",
    "kind": "adapter",
    "version": "1.0.0"
  },
  "pack_api_version": "rumi.pack.v3",
  "permissions": [
    {
      "access": "read",
      "approval_required": false,
      "capability": "mcp.server.catalog.read"
    },
    {
      "access": "execute",
      "approval_required": false,
      "capability": "mcp.server.tool.call"
    }
  ],
  "provenance": {
    "build_identity": "rumi_mcp_server_pack:1.0.0",
    "content_hash": "sha256:a54adc7a4a7c6ab9a2edaa8ec562540b971618936eadcc1ed79a46d87b35b686",
    "signature": null,
    "trust_class": "local"
  },
  "resources": [],
  "storage": []
}
