{
  "contracts": {
    "provides": [
      {
        "cardinality": "many",
        "failure": "fail_closed",
        "id": "rumi.service.tool.execute.v1",
        "isolation": "in_process",
        "lifecycle": {
          "data_owner": "domain-service",
          "deprecated": false,
          "introduced": "1.0.0"
        },
        "provider_instance_id": "tool-executor.local",
        "required_capabilities": [
          "tool.execute"
        ],
        "routing_keys": [
          "local"
        ],
        "schemas": {
          "input": {
            "type": "object"
          },
          "output": {
            "type": "object"
          }
        },
        "security": "restricted",
        "version": "1.0.0"
      }
    ],
    "requires": [
      {
        "cardinality": "many",
        "id": "rumi.service.tool.local.operation.v1",
        "optional": false,
        "version_range": "^1.0.0"
      }
    ]
  },
  "entrypoints": [
    {
      "artifact_hash": "sha256:e93ac0d12dcac61de36f1e8abe9e0ee1ce69c18cb992223b188050f472d32968",
      "contract_id": "rumi.service.tool.execute.v1",
      "id": "tool-local-execute",
      "loader": "python",
      "module": "ecosystem.rumi_tool_local_executor_pack.runtime.executor",
      "symbol": "create_execute_operation"
    }
  ],
  "extensions": {
    "rumi.legacy_projection": {
      "dependencies": {},
      "host_execution": true,
      "manifest": {
        "connectivity": {
          "provides": [
            "rumi.service.tool.execute.v1"
          ],
          "requires": [
            "rumi.service.tool.local.operation.v1"
          ]
        },
        "dependencies": {},
        "description": "Generic selected local-service adapter executor.",
        "display_name": "Rumi Tool Local Executor",
        "host_execution": true,
        "metadata": {
          "authoritative_owner": true,
          "canonical_v4": {
            "artifact": "pack.v4.json",
            "artifact_digest": "sha256:c3b913ae0094d9f927d51fde9120b5dc80d7a91527d6630b085d2d14a1d78090",
            "generator": "tobkiri.scripts.migrate_manifest_authority/v2",
            "source_identity": "sha256:fb43613851c8966f6ed843a9bf861c472835ac805a13002e21d92627365509a2"
          },
          "integrity": {
            "artifact_manifest": "artifact-manifest.json"
          },
          "owner_surfaces": [
            "local_tool_execution"
          ],
          "projection_owner": "scripts/migrate_manifest_authority.py",
          "security": {
            "domain_service_imports": false,
            "exact_provider": true
          }
        },
        "pack_id": "rumi_tool_local_executor_pack",
        "pack_identity": "rumi:ecosystem/rumi_tool_local_executor_pack",
        "provenance": {
          "build_identity": "rumi_tool_local_executor_pack:1.0.0",
          "content_hash": "sha256:102c7da605ec08d384f45b63165ccccdda346b159887cc5471b72ceac84228d8",
          "signature": null,
          "trust_class": "local"
        },
        "required_capabilities": [
          "tool.execute"
        ],
        "required_network": {
          "allowed_domains": [],
          "allowed_ports": []
        },
        "required_secrets": [],
        "resources": [],
        "version": "1.0.0",
        "vocabulary": {
          "types": [
            "service"
          ]
        }
      },
      "pack_id": "rumi_tool_local_executor_pack"
    },
    "rumi.tool_executor.boundary": {
      "domain_service_imports": false,
      "execution_kind": "local",
      "provider_selection": "manifest_selected_exact"
    },
    "tobkiri.offline_projection": {
      "generator": "tobkiri.scripts.migrate_manifest_authority/v2",
      "owner": "rumi_tool_local_executor_pack",
      "runtime_executable": false,
      "source": "pack.v4.json",
      "source_identity": "sha256:fb43613851c8966f6ed843a9bf861c472835ac805a13002e21d92627365509a2"
    }
  },
  "migration": {
    "compatibility_aliases": [],
    "compatibility_projection": "none",
    "from": [
      "defaultspack.domain.tool.executor.local"
    ],
    "removal_wave": 10,
    "rollback": "Remove this executor; local services remain available without tool projection.",
    "sunset_at": "2027-12-31"
  },
  "pack": {
    "description": "Generic selected local-service adapter executor.",
    "display_name": "Rumi Tool Local Executor",
    "id": "rumi.tool_local_executor",
    "kind": "service",
    "version": "1.0.0"
  },
  "pack_api_version": "rumi.pack.v3",
  "permissions": [
    {
      "access": "execute",
      "approval_required": false,
      "capability": "tool.execute"
    }
  ],
  "provenance": {
    "build_identity": "rumi_tool_local_executor_pack:1.0.0",
    "content_hash": "sha256:102c7da605ec08d384f45b63165ccccdda346b159887cc5471b72ceac84228d8",
    "signature": null,
    "trust_class": "local"
  },
  "resources": [],
  "storage": []
}
